[
  {
    "id": "oracle.compress",
    "name": "Input Compression",
    "domain": "planning",
    "description": "Compress messy input into objective/entities.",
    "inputs": [],
    "outputs": [],
    "risk": "low",
    "requires_approval": false,
    "network_allowed": false,
    "tools": [],
    "status": "active"
  },
  {
    "id": "oracle.classify",
    "name": "Task Classification",
    "domain": "planning",
    "description": "Classify task type, urgency, complexity, risk.",
    "inputs": [],
    "outputs": [],
    "risk": "low",
    "requires_approval": false,
    "network_allowed": false,
    "tools": [],
    "status": "active"
  },
  {
    "id": "oracle.score",
    "name": "Task Scoring",
    "domain": "planning",
    "description": "Score value, urgency, effort, risk, readiness.",
    "inputs": [],
    "outputs": [],
    "risk": "low",
    "requires_approval": false,
    "network_allowed": false,
    "tools": [],
    "status": "active"
  },
  {
    "id": "oracle.route",
    "name": "Route",
    "domain": "planning",
    "description": "Pick the best skill for a task.",
    "inputs": [],
    "outputs": [],
    "risk": "low",
    "requires_approval": false,
    "network_allowed": false,
    "tools": [],
    "status": "active"
  },
  {
    "id": "mia.next_action",
    "name": "Next Action",
    "domain": "execution",
    "description": "Choose the smallest useful next step.",
    "inputs": [],
    "outputs": [],
    "risk": "low",
    "requires_approval": false,
    "network_allowed": false,
    "tools": [],
    "status": "active"
  },
  {
    "id": "mia.close_loop",
    "name": "Loop Closure",
    "domain": "execution",
    "description": "Turn a stuck task into a clear checkpoint.",
    "inputs": [],
    "outputs": [],
    "risk": "medium",
    "requires_approval": true,
    "network_allowed": false,
    "tools": [],
    "status": "active"
  },
  {
    "id": "guard.risk_check",
    "name": "Safety Check",
    "domain": "safety",
    "description": "Detect unsafe actions and approvals.",
    "inputs": [],
    "outputs": [],
    "risk": "low",
    "requires_approval": false,
    "network_allowed": false,
    "tools": [],
    "status": "active"
  },
  {
    "id": "scribe.log",
    "name": "Logger",
    "domain": "logging",
    "description": "Write logs and summaries.",
    "inputs": [],
    "outputs": [],
    "risk": "low",
    "requires_approval": false,
    "network_allowed": false,
    "tools": [],
    "status": "active"
  },
  {
    "id": "repo.inspect",
    "name": "Repo Inspector",
    "domain": "repo",
    "description": "Safely inspect repository structure.",
    "inputs": [],
    "outputs": [],
    "risk": "low",
    "requires_approval": false,
    "network_allowed": false,
    "tools": [],
    "status": "active"
  },
  {
    "id": "repo.checkpoint",
    "name": "Checkpoint Prep",
    "domain": "repo",
    "description": "Prepare git add/commit; push requires approval.",
    "inputs": [],
    "outputs": [],
    "risk": "medium",
    "requires_approval": true,
    "network_allowed": false,
    "tools": [],
    "status": "active"
  },
  {
    "id": "code.smoke_test",
    "name": "Smoke Tester",
    "domain": "code",
    "description": "Run syntax and minimal smoke tests.",
    "inputs": [],
    "outputs": [],
    "risk": "low",
    "requires_approval": false,
    "network_allowed": false,
    "tools": [],
    "status": "active"
  },
  {
    "id": "memory.store",
    "name": "Memory Store",
    "domain": "memory",
    "description": "Persist durable facts to memory files.",
    "inputs": [],
    "outputs": [],
    "risk": "low",
    "requires_approval": false,
    "network_allowed": false,
    "tools": [],
    "status": "active"
  },
  {
    "id": "download.triage",
    "name": "Downloads Triage",
    "domain": "file",
    "description": "Classify files without moving unless approved.",
    "inputs": [],
    "outputs": [],
    "risk": "medium",
    "requires_approval": true,
    "network_allowed": false,
    "tools": [],
    "status": "active"
  },
  {
    "id": "resale.price_research",
    "name": "Price Research",
    "domain": "resale",
    "description": "Plan pricing research; network needs approval.",
    "inputs": [],
    "outputs": [],
    "risk": "medium",
    "requires_approval": true,
    "network_allowed": true,
    "tools": [],
    "status": "active"
  },
  {
    "id": "inventory.route",
    "name": "Inventory Sort",
    "domain": "inventory",
    "description": "Classify items into resale/repair/archive/donate/personal.",
    "inputs": [],
    "outputs": [],
    "risk": "low",
    "requires_approval": false,
    "network_allowed": false,
    "tools": [],
    "status": "active"
  },
  {
    "id": "docs.summarize",
    "name": "Docs Summarizer",
    "domain": "docs",
    "description": "Summarize local docs and extract tasks.",
    "inputs": [],
    "outputs": [],
    "risk": "low",
    "requires_approval": false,
    "network_allowed": false,
    "tools": [],
    "status": "active"
  },
  {
    "id": "sourcing.plan",
    "name": "Research Planner",
    "domain": "research",
    "description": "Plan sources before research.",
    "inputs": [],
    "outputs": [],
    "risk": "low",
    "requires_approval": false,
    "network_allowed": false,
    "tools": [],
    "status": "active"
  },
  {
    "id": "sourcing.collect",
    "name": "Data Collector",
    "domain": "research",
    "description": "Collect data from approved sources.",
    "inputs": [],
    "outputs": [],
    "risk": "medium",
    "requires_approval": true,
    "network_allowed": true,
    "tools": [],
    "status": "active"
  },
  {
    "id": "sourcing.verify",
    "name": "Verifier",
    "domain": "research",
    "description": "Compare sources and flag conflicts.",
    "inputs": [],
    "outputs": [],
    "risk": "low",
    "requires_approval": false,
    "network_allowed": false,
    "tools": [],
    "status": "active"
  },
  {
    "id": "godmode.best_one",
    "name": "Best-One Selector",
    "domain": "planning",
    "description": "Choose the single strongest safe action.",
    "inputs": [],
    "outputs": [],
    "risk": "low",
    "requires_approval": false,
    "network_allowed": false,
    "tools": [],
    "status": "active"
  },
  {
    "id": "security.threat_model",
    "name": "Threat Model",
    "domain": "security",
    "description": "Identify assets, attackers, entry points, trust boundaries, risks, mitigations.",
    "inputs": [],
    "outputs": [],
    "risk": "low",
    "requires_approval": false,
    "network_allowed": false,
    "tools": [],
    "status": "active"
  },
  {
    "id": "security.repo_hardening",
    "name": "Repo Hardening",
    "domain": "security",
    "description": "Inspect repo for exposed secrets, weak configs, unsafe permissions, .gitignore gaps.",
    "inputs": [],
    "outputs": [],
    "risk": "medium",
    "requires_approval": true,
    "network_allowed": false,
    "tools": [],
    "status": "active"
  },
  {
    "id": "security.secret_scan",
    "name": "Secret Scan",
    "domain": "security",
    "description": "Search local repo for accidental secrets and mask findings.",
    "inputs": [],
    "outputs": [],
    "risk": "medium",
    "requires_approval": true,
    "network_allowed": false,
    "tools": [],
    "status": "active"
  },
  {
    "id": "security.dependency_review",
    "name": "Dependency Review",
    "domain": "security",
    "description": "Review dependency files for risky packages. Network only with approval.",
    "inputs": [],
    "outputs": [],
    "risk": "medium",
    "requires_approval": true,
    "network_allowed": true,
    "tools": [],
    "status": "active"
  },
  {
    "id": "security.safe_vuln_explain",
    "name": "Safe Vulnerability Explanation",
    "domain": "security",
    "description": "Explain vulnerabilities defensively and suggest remediation.",
    "inputs": [],
    "outputs": [],
    "risk": "low",
    "requires_approval": false,
    "network_allowed": false,
    "tools": [],
    "status": "active"
  },
  {
    "id": "security.ctf_lab",
    "name": "CTF Lab",
    "domain": "security",
    "description": "Allow toy/lab-only security learning.",
    "inputs": [],
    "outputs": [],
    "risk": "medium",
    "requires_approval": true,
    "network_allowed": false,
    "tools": [],
    "status": "active"
  },
  {
    "id": "security.incident_notes",
    "name": "Incident Notes",
    "domain": "security",
    "description": "Create calm incident notes, evidence checklist, timeline, defensive next actions.",
    "inputs": [],
    "outputs": [],
    "risk": "low",
    "requires_approval": false,
    "network_allowed": false,
    "tools": [],
    "status": "active"
  }
]
